{
  "eventId": "evt_local_004",
  "eventType": "deployment.export.requested",
  "deploymentId": "dep_local_004",
  "teamId": "team_local",
  "siteId": "site_local",
  "pageId": "page_huge",
  "slug": "huge",
  "version": "v1",
  "renderMode": "fetch_route",
  "targetId": "target_platform_local",
  "environment": "production",
  "idempotencyKey": "dep_local_004",
  "createdAt": "2026-07-01T17:00:00Z"
}
